<?xml version="1.0"?>
<!DOCTYPE Report
[
<!ELEMENT Report (General ,(Doc|BPT)) >
<!ATTLIST Report ver CDATA #REQUIRED tmZone CDATA #REQUIRED>

<!ELEMENT General ( DocLocation ) >
<!ATTLIST General productName CDATA #REQUIRED productVer CDATA #REQUIRED os CDATA #REQUIRED host CDATA #REQUIRED qcserver CDATA #IMPLIED qcproject CDATA #IMPLIED SolManSolutionId CDATA #IMPLIED SolManProjectId CDATA #IMPLIED SolManTestPlanId CDATA #IMPLIED SolManTestPackageId CDATA #IMPLIED SolManUserInfoData CDATA #IMPLIED  >

<!ELEMENT BPT (DName,Res,DVer?,TSet?,TInst?,NodeArgs,AdditionalInfo*,Doc*) >
<!ATTLIST BPT rID ID #REQUIRED >

<!ELEMENT Doc (DName,ConfName?,Res,DVer?,TSet?,TInst?,RunType?,DT?,AdditionalInfo*,Step*,DIter*,Step*,Action*,Doc*,Summary?,TestMaintenanceSummary*,NodeArgs?) >
<!ATTLIST Doc rID ID #REQUIRED type (Test|BC|BPTWrapperTest|Flow|Group|Action) "Test" productName CDATA #REQUIRED BCIter CDATA #IMPLIED >

<!ELEMENT RunType ( #PCDATA )>
<!ATTLIST RunType fmStep (False|True) "False" batch (False|True) "False" upDesc (False|True) "False" upChk (False|True) "False" upAS (False|True) "False">

<!ELEMENT DName ( #PCDATA ) >

<!ELEMENT ConfName ( #PCDATA ) >

<!ELEMENT Res ( #PCDATA ) >

<!ELEMENT AdditionalInfo (AdditionalDataName,AdditionalDataValue ) >

<!ELEMENT AdditionalDataName ( #PCDATA ) >

<!ELEMENT AdditionalDataValue ( #PCDATA ) >

<!ELEMENT DVer ( #PCDATA ) >

<!ELEMENT TSet ( #PCDATA ) >

<!ELEMENT TInst ( #PCDATA ) >

<!ELEMENT DIter (Step*,Action+,Summary?,NodeArgs)>
<!ATTLIST DIter rID ID #REQUIRED iterID CDATA #REQUIRED>

<!ELEMENT DocLocation ( #PCDATA )>

<!ELEMENT Action (AName,AIter*,(Step|HtmlStep|Action)*, Summary,ActionMaintenanceSummary*, NodeArgs ) >
<!ATTLIST Action rID ID #REQUIRED>

<!ELEMENT AIter ((Step|HtmlStep|Action)*,DataMapping?, Summary?,NodeArgs) >
<!ATTLIST AIter rID ID #REQUIRED iterID CDATA #REQUIRED isCountable (False|True) "False" >

<!ELEMENT AName ( #PCDATA ) >

<!ELEMENT TestMaintenanceSummary (ActionMaintenanceSummary*) >
<!ATTLIST TestMaintenanceSummary ObjectsAdded CDATA #REQUIRED ObjectsUpdated CDATA #REQUIRED StepsUpdated CDATA #REQUIRED StepsComments CDATA #REQUIRED><!ELEMENT ActionMaintenanceSummary (ObjectChange* ) >
<!ATTLIST ActionMaintenanceSummary Action CDATA #REQUIRED Objects CDATA #REQUIRED Updated CDATA #REQUIRED LinesTotal CDATA #REQUIRED Added CDATA #REQUIRED LinesUpdated CDATA #REQUIRED>

<!ELEMENT ObjectChange  (Hierarchy, PropertyChangeList* ) >
<!ATTLIST ObjectChange Operation CDATA #IMPLIED OriginalRepository CDATA #IMPLIED>

<!ELEMENT PropertyChangeList (PropertyDef*) >

<!ELEMENT PropertyDef (OriginalValue, NewValue) >
<!ATTLIST PropertyDef PropName CDATA #REQUIRED OriginRegularExpression (True|False) "False" NewRegularExpression (True|False) "False" AddedProperty (True|False) "False" >

<!ELEMENT OriginalValue ( #PCDATA )>

<!ELEMENT NewValue ( #PCDATA )>

<!ELEMENT Hierarchy  (ObjectName, Hierarchy*) >
<!ATTLIST Hierarchy MicClass CDATA #REQUIRED>

<!ELEMENT ObjectName  ( #PCDATA ) >

<!ELEMENT Step (Obj,Details,Time,TimeTick* ,(Step|HtmlStep|Doc)*, DataMapping?, NodeArgs) >
<!ATTLIST Step rID ID #REQUIRED retval CDATA #IMPLIED>

<!ELEMENT HtmlStep (HTML,TimeTick*,(Step|HtmlStep|Doc)*,NodeArgs) >
<!ATTLIST HtmlStep rID ID #REQUIRED >

<!ELEMENT Obj ( #PCDATA ) >
<!ATTLIST Obj plainTxt (False|True) "True">

<!ELEMENT Details ( #PCDATA ) >
<!ATTLIST Details plainTxt (False|True) "True">

<!ELEMENT Time ( #PCDATA ) >

<!ELEMENT HTML ( #PCDATA ) >

<!ELEMENT Disp ( #PCDATA ) >

<!ELEMENT TimeTick ( #PCDATA ) >

<!ELEMENT DataMapping ( DataMappedItem* )>
<!ELEMENT DataMappedItem EMPTY >
<!ATTLIST DataMappedItem dsName CDATA #REQUIRED >
<!ATTLIST DataMappedItem rowId CDATA #REQUIRED >

<!ELEMENT NodeArgs (Disp,TopPane?,BtmPane?,ExtendedInfo? )>
<!ATTLIST NodeArgs eType CDATA #REQUIRED icon CDATA #REQUIRED nRep CDATA #REQUIRED UserNote CDATA #IMPLIED filter (False|True) "True">
<!ATTLIST NodeArgs status (Passed|Failed|Done|Warning|Information) "Done">
<!ATTLIST NodeArgs iconSel CDATA #IMPLIED nType CDATA #IMPLIED MovieMarker CDATA "">
<!ATTLIST NodeArgs Source CDATA #IMPLIED SourceLine CDATA #IMPLIED StepFlowItemKey CDATA #IMPLIED >

<!ELEMENT TopPane (Path)>

<!ELEMENT BtmPane ( (Path|WR)?,ASHilite?)>
<!ATTLIST BtmPane vType CDATA "HTML">

<!ELEMENT Path ( #PCDATA ) >

<!ELEMENT ASHilite ( #PCDATA ) >

<!ELEMENT WR ( #PCDATA ) >

<!ELEMENT ExtendedInfo ( StepData ) >

<!ATTLIST ExtendedInfo StepType CDATA #REQUIRED>
<!ELEMENT DT (NodeArgs) >
<!ATTLIST DT rID ID #REQUIRED>

<!ELEMENT Summary (Param*)>
<!ATTLIST Summary sTime CDATA #IMPLIED eTime CDATA #IMPLIED passed CDATA #IMPLIED failed CDATA #IMPLIED warnings CDATA #IMPLIED retval CDATA #IMPLIED stopped (False|True) "False" >

<!ELEMENT Param (ParamName,ParamVal)+ >
<!ATTLIST Param paramInOut (In|Out) "In">

<!ELEMENT ParamName ( #PCDATA ) >

<!ELEMENT ParamVal ( #PCDATA ) >

]
>
<Report ver="2.0" tmZone="India Standard Time">
<General productName="HPE Unified Functional Testing" productVer="14.03" os="" host="LIN33001220"><DocLocation><![CDATA[C:\framework\QTP-Hybrid-Framework\QTP-Hybrid-Framework\TestCases\od]]></DocLocation></General>
<Doc rID="T1"   productName= "HPE Unified Functional Testing"  >
<DName><![CDATA[od]]></DName>
<Res><![CDATA[Res6]]></Res>
<DT rID="T2">
<NodeArgs eType="Table" icon="2" nRep="4" filter="False" >
<Disp><![CDATA[Run-Time Data Table]]></Disp>
<BtmPane vType="Table" >
<Path><![CDATA[Default.xls]]></Path>
</BtmPane>
</NodeArgs>
</DT>
<DIter rID="T3" iterID="1" >
<Action rID="T4">
<AName><![CDATA[login]]></AName>
<Step rID="T5">
<Obj plainTxt="False" ><![CDATA[[ username ].Set]]></Obj>
<Details plainTxt="False" ><![CDATA["Admin"]]></Details>
<Time><![CDATA[15-02-2023 - 09:48:43]]></Time>
<TimeTick>1676434723</TimeTick>
<NodeArgs eType="Replay" icon="5" nRep="10" Source="login" SourceLine="1" >
<Disp><![CDATA[[ username ].Set]]></Disp>
</NodeArgs>
</Step>
<Step rID="T6">
<Obj plainTxt="False" ><![CDATA[[ password ].Set]]></Obj>
<Details plainTxt="False" ><![CDATA["63ec561fd264bb0efa7edbbaaec36a184300fddb7806"]]></Details>
<Time><![CDATA[15-02-2023 - 09:48:43]]></Time>
<TimeTick>1676434723</TimeTick>
<NodeArgs eType="Replay" icon="5" nRep="13" Source="login" SourceLine="2" >
<Disp><![CDATA[[ password ].Set]]></Disp>
</NodeArgs>
</Step>
<Step rID="T7">
<Obj plainTxt="False" ><![CDATA[[  Login  ].Click]]></Obj>
<Details plainTxt="False" ><![CDATA[]]></Details>
<Time><![CDATA[15-02-2023 - 09:48:43]]></Time>
<TimeTick>1676434723</TimeTick>
<NodeArgs eType="Replay" icon="6" nRep="16" Source="login" SourceLine="3" >
<Disp><![CDATA[[  Login  ].Click]]></Disp>
</NodeArgs>
</Step>
<Step rID="T8">
<Obj plainTxt="False" ><![CDATA[OrangeHRM]]></Obj>
<Details plainTxt="False" ><![CDATA[<table><tr><td><span style="text-align : left; font-size : 12px; ">Local Browser</span></td></tr></table>]]></Details>
<Time><![CDATA[15-02-2023 - 09:48:45]]></Time>
<TimeTick>1676434725</TimeTick>
<Step rID="T9">
<Obj plainTxt="False" ><![CDATA[OrangeHRM_2]]></Obj>
<Details plainTxt="False" ><![CDATA[Page]]></Details>
<Time><![CDATA[15-02-2023 - 09:48:45]]></Time>
<TimeTick>1676434725</TimeTick>
<Step rID="T10">
<Obj plainTxt="False" ><![CDATA[PIM.Click]]></Obj>
<Details plainTxt="False" ><![CDATA[]]></Details>
<Time><![CDATA[15-02-2023 - 09:48:45]]></Time>
<TimeTick>1676434725</TimeTick>
<NodeArgs eType="Replay" icon="9" nRep="21" Source="login" SourceLine="4" >
<Disp><![CDATA[PIM.Click]]></Disp>
</NodeArgs>
</Step>
<NodeArgs eType="Context" icon="8" nRep="20" Source="login" SourceLine="4" >
<Disp><![CDATA[OrangeHRM_2]]></Disp>
</NodeArgs>
</Step>
<Step rID="T11">
<Obj plainTxt="False" ><![CDATA[OrangeHRM_3]]></Obj>
<Details plainTxt="False" ><![CDATA[Page]]></Details>
<Time><![CDATA[15-02-2023 - 09:48:47]]></Time>
<TimeTick>1676434727</TimeTick>
<Step rID="T12">
<Obj plainTxt="False" ><![CDATA[WebEdit.Set]]></Obj>
<Details plainTxt="False" ><![CDATA["1234"]]></Details>
<Time><![CDATA[15-02-2023 - 09:48:47]]></Time>
<TimeTick>1676434727</TimeTick>
<NodeArgs eType="Replay" icon="5" nRep="25" Source="login" SourceLine="5" >
<Disp><![CDATA[WebEdit.Set]]></Disp>
</NodeArgs>
</Step>
<Step rID="T13">
<Obj plainTxt="False" ><![CDATA[Search.Click]]></Obj>
<Details plainTxt="False" ><![CDATA[]]></Details>
<Time><![CDATA[15-02-2023 - 09:48:47]]></Time>
<TimeTick>1676434727</TimeTick>
<NodeArgs eType="Replay" icon="6" nRep="28" Source="login" SourceLine="6" >
<Disp><![CDATA[Search.Click]]></Disp>
</NodeArgs>
</Step>
<Step rID="T14">
<Obj plainTxt="False" ><![CDATA[Add.Click]]></Obj>
<Details plainTxt="False" ><![CDATA[]]></Details>
<Time><![CDATA[15-02-2023 - 09:48:47]]></Time>
<TimeTick>1676434727</TimeTick>
<NodeArgs eType="Replay" icon="6" nRep="31" Source="login" SourceLine="7" >
<Disp><![CDATA[Add.Click]]></Disp>
</NodeArgs>
</Step>
<NodeArgs eType="Context" icon="8" nRep="24" Source="login" SourceLine="5" >
<Disp><![CDATA[OrangeHRM_3]]></Disp>
</NodeArgs>
</Step>
<Step rID="T15">
<Obj plainTxt="False" ><![CDATA[OrangeHRM_4]]></Obj>
<Details plainTxt="False" ><![CDATA[Page]]></Details>
<Time><![CDATA[15-02-2023 - 09:48:49]]></Time>
<TimeTick>1676434729</TimeTick>
<Step rID="T16">
<Obj plainTxt="False" ><![CDATA[firstName.Set]]></Obj>
<Details plainTxt="False" ><![CDATA["SSSSSSSSSSSSSSSSST"]]></Details>
<Time><![CDATA[15-02-2023 - 09:48:49]]></Time>
<TimeTick>1676434729</TimeTick>
<NodeArgs eType="Replay" icon="5" nRep="35" Source="login" SourceLine="8" >
<Disp><![CDATA[firstName.Set]]></Disp>
</NodeArgs>
</Step>
<Step rID="T17">
<Obj plainTxt="False" ><![CDATA[lastName.Set]]></Obj>
<Details plainTxt="False" ><![CDATA["s"]]></Details>
<Time><![CDATA[15-02-2023 - 09:48:49]]></Time>
<TimeTick>1676434729</TimeTick>
<NodeArgs eType="Replay" icon="5" nRep="38" Source="login" SourceLine="9" >
<Disp><![CDATA[lastName.Set]]></Disp>
</NodeArgs>
</Step>
<Step rID="T18">
<Obj plainTxt="False" ><![CDATA[WebEdit.Set]]></Obj>
<Details plainTxt="False" ><![CDATA["1234"]]></Details>
<Time><![CDATA[15-02-2023 - 09:48:49]]></Time>
<TimeTick>1676434729</TimeTick>
<NodeArgs eType="Replay" icon="5" nRep="41" Source="login" SourceLine="10" >
<Disp><![CDATA[WebEdit.Set]]></Disp>
</NodeArgs>
</Step>
<Step rID="T19">
<Obj plainTxt="False" ><![CDATA[Save.Click]]></Obj>
<Details plainTxt="False" ><![CDATA[]]></Details>
<Time><![CDATA[15-02-2023 - 09:48:49]]></Time>
<TimeTick>1676434729</TimeTick>
<NodeArgs eType="Replay" icon="6" nRep="44" Source="login" SourceLine="11" >
<Disp><![CDATA[Save.Click]]></Disp>
</NodeArgs>
</Step>
<NodeArgs eType="Context" icon="8" nRep="34" Source="login" SourceLine="8" >
<Disp><![CDATA[OrangeHRM_4]]></Disp>
</NodeArgs>
</Step>
<Step rID="T20">
<Obj plainTxt="False" ><![CDATA[OrangeHRM_6]]></Obj>
<Details plainTxt="False" ><![CDATA[Page]]></Details>
<Time><![CDATA[15-02-2023 - 09:48:49]]></Time>
<TimeTick>1676434729</TimeTick>
<Step rID="T21">
<Obj plainTxt="False" ><![CDATA[Save.Click]]></Obj>
<Details plainTxt="False" ><![CDATA[]]></Details>
<Time><![CDATA[15-02-2023 - 09:48:49]]></Time>
<TimeTick>1676434729</TimeTick>
<NodeArgs eType="Replay" icon="6" nRep="48" Source="login" SourceLine="12" >
<Disp><![CDATA[Save.Click]]></Disp>
</NodeArgs>
</Step>
<Step rID="T22">
<Obj plainTxt="False" ><![CDATA[Save_2.Click]]></Obj>
<Details plainTxt="False" ><![CDATA[]]></Details>
<Time><![CDATA[15-02-2023 - 09:48:49]]></Time>
<TimeTick>1676434729</TimeTick>
<NodeArgs eType="Replay" icon="6" nRep="51" Source="login" SourceLine="13" >
<Disp><![CDATA[Save_2.Click]]></Disp>
</NodeArgs>
</Step>
<Step rID="T23">
<Obj plainTxt="False" ><![CDATA[PIM.Click]]></Obj>
<Details plainTxt="False" ><![CDATA[]]></Details>
<Time><![CDATA[15-02-2023 - 09:48:49]]></Time>
<TimeTick>1676434729</TimeTick>
<NodeArgs eType="Replay" icon="9" nRep="54" Source="login" SourceLine="14" >
<Disp><![CDATA[PIM.Click]]></Disp>
</NodeArgs>
</Step>
<NodeArgs eType="Context" icon="8" nRep="47" Source="login" SourceLine="12" >
<Disp><![CDATA[OrangeHRM_6]]></Disp>
</NodeArgs>
</Step>
<Step rID="T24">
<Obj plainTxt="False" ><![CDATA[OrangeHRM_3]]></Obj>
<Details plainTxt="False" ><![CDATA[Page]]></Details>
<Time><![CDATA[15-02-2023 - 09:48:51]]></Time>
<TimeTick>1676434731</TimeTick>
<Step rID="T25">
<Obj plainTxt="False" ><![CDATA[WebEdit.Set]]></Obj>
<Details plainTxt="False" ><![CDATA["1234"]]></Details>
<Time><![CDATA[15-02-2023 - 09:48:51]]></Time>
<TimeTick>1676434731</TimeTick>
<NodeArgs eType="Replay" icon="5" nRep="58" Source="login" SourceLine="15" >
<Disp><![CDATA[WebEdit.Set]]></Disp>
</NodeArgs>
</Step>
<Step rID="T26">
<Obj plainTxt="False" ><![CDATA[Search.Click]]></Obj>
<Details plainTxt="False" ><![CDATA[]]></Details>
<Time><![CDATA[15-02-2023 - 09:48:51]]></Time>
<TimeTick>1676434731</TimeTick>
<NodeArgs eType="Replay" icon="6" nRep="61" Source="login" SourceLine="16" >
<Disp><![CDATA[Search.Click]]></Disp>
</NodeArgs>
</Step>
<Step rID="T27">
<Obj plainTxt="False" ><![CDATA["WebCheckBox_2"- Smart Identification]]></Obj>
<Details plainTxt="False" ><![CDATA[<P><span class="text">The smart identification mechanism was invoked.</span></P><P><SPAN class=text>Reason: object not unique (47 objects found)</SPAN></P>           <SPAN class=text><b>Original description:</b></SPAN><br>type=checkbox<br>role=<br>name=<br>micclass=WebCheckBox<br>html tag=INPUT<br>acc_name=<br><P><FONT face=Verdana size=2><SPAN class=text><B>Smart Identification Alternative Description: </B></SPAN></FONT></P><FONT face=Verdana size=2><u>Base filter properties (3 objects found)&nbsp;</FONT></u><br>
micclass=WebCheckBox<br>html tag=INPUT<br><br><FONT face=Verdana size=2><u>Optional filter properties</FONT></u><br>
name=<SPAN class=passed> (Used</SPAN>, 3 matches)</SPAN><br>type=checkbox<SPAN class=passed> (Used</SPAN>, 3 matches)</SPAN><br>html id=<SPAN class=passed> (Used</SPAN>, 3 matches)</SPAN><br>value=0<SPAN class=passed> (Used</SPAN>, 1 matches)</SPAN><br>class=<SPAN class=warning> (Ignored)<FONT color=#000000></FONT></SPAN><br>visible=-1<SPAN class=warning> (Ignored)<FONT color=#000000></FONT></SPAN><br>]]></Details>
<Time><![CDATA[15-02-2023 - 09:48:52]]></Time>
<TimeTick>1676434732</TimeTick>
<NodeArgs eType="Replay" icon="10" nRep="65" Source="login" SourceLine="17" >
<Disp><![CDATA["WebCheckBox_2"- Smart Identification]]></Disp>
</NodeArgs>
</Step>
<Step rID="T28">
<Obj plainTxt="False" ><![CDATA[WebCheckBox_2.Set]]></Obj>
<Details plainTxt="False" ><![CDATA["ON"]]></Details>
<Time><![CDATA[15-02-2023 - 09:48:52]]></Time>
<TimeTick>1676434732</TimeTick>
<NodeArgs eType="Replay" icon="11" nRep="66" Source="login" SourceLine="17" >
<Disp><![CDATA[WebCheckBox_2.Set]]></Disp>
</NodeArgs>
</Step>
<Step rID="T29">
<Obj plainTxt="False" ><![CDATA[Delete Selected.Click]]></Obj>
<Details plainTxt="False" ><![CDATA[]]></Details>
<Time><![CDATA[15-02-2023 - 09:48:52]]></Time>
<TimeTick>1676434732</TimeTick>
<NodeArgs eType="Replay" icon="6" nRep="69" Source="login" SourceLine="18" >
<Disp><![CDATA[Delete Selected.Click]]></Disp>
</NodeArgs>
</Step>
<Step rID="T30">
<Obj plainTxt="False" ><![CDATA[Yes, Delete.Click]]></Obj>
<Details plainTxt="False" ><![CDATA[]]></Details>
<Time><![CDATA[15-02-2023 - 09:48:52]]></Time>
<TimeTick>1676434732</TimeTick>
<NodeArgs eType="Replay" icon="6" nRep="72" Source="login" SourceLine="19" >
<Disp><![CDATA[Yes, Delete.Click]]></Disp>
</NodeArgs>
</Step>
<NodeArgs eType="Context" icon="8" nRep="57" Source="login" SourceLine="15" >
<Disp><![CDATA[OrangeHRM_3]]></Disp>
</NodeArgs>
</Step>
<NodeArgs eType="Context" icon="7" nRep="19" Source="login" SourceLine="4" >
<Disp><![CDATA[OrangeHRM]]></Disp>
</NodeArgs>
</Step>
<Summary sTime="15-02-2023 - 09:48:42" eTime="15-02-2023 - 09:48:52" passed="0" failed="0" warnings="0" ></Summary>
<NodeArgs eType="StartAction" icon="4" nRep="7" >
<Disp><![CDATA[login Summary]]></Disp>
</NodeArgs>
</Action>
<NodeArgs eType="StartIteration" icon="3" nRep="6" >
<Disp><![CDATA[od Iteration 1 (Row 1)]]></Disp>
</NodeArgs>
</DIter>
<Summary sTime="15-02-2023 - 09:48:35" eTime="15-02-2023 - 09:48:52" passed="0" failed="0" warnings="0" ></Summary>
<NodeArgs eType="StartTest" icon="1" nRep="3" >
<Disp><![CDATA[Test od Summary]]></Disp>
</NodeArgs>
</Doc>
</Report>